<?xml version="1.0" encoding="UTF-8"?>
<ed:eDreams xmlns:xsi="http://www.w3.org/2001/XMLSchema-instance"
xmlns:ed="http://www.edreams.es"
xsi:schemaLocation="http://www.edreams.com eDreams.xsd ">
	
	<vuelo>
		<viaje>
			<origen>PMI</origen>
			<destino>BER</destino>
			<escalas>False</escalas>
		</viaje>
		<fecha>
			<salida>26/02/2016</salida>
			<regreso>01/03/2016</regreso>
		</fecha>
    	<pasajeros>
        	<adultos>1</adultos>
        	<ninos>0</ninos>
        	<bebes>0</bebes>
    	</pasajeros>
    	<clase>
        	<turista/>
        </clase>
	</vuelo>
	
</ed:eDreams>